<!--
  ~ Copyright (c) 2023 Geo-Studios and/or its affiliates. All rights reserved.
  ~ DO NOT ALTER OR REMOVE COPYRIGHT NOTICES OR THIS FILE HEADER.
  ~
  ~ This code is free software; you can redistribute it and/or modify it under
  ~ the terms of the GNU General Public License version 2 only, as published
  ~ by the Free Software Foundation. Geo-Studios designates this particular
  ~ file as subject to the "Classpath" exception as provided
  ~ by Geo-Studio in the LICENSE file that accompanied this code.
  ~
  ~ This code is distributed in the hope that it will be useful, but WITHOUT
  ~ ANY WARRANTY; without even the implied warranty of
  ~ MERCHANTABILITY or FITNESS FOR A PARTICULAR PURPOSE. See the
  ~ GNU General Public License version 2 for more details (a copy is
  ~ included in the LICENSE file that accompanied this code).
  ~
  ~ You should have received a copy of the GNU General Public License
  ~ version 2 along with this work; if not, write to the Free Software
  ~ Foundation, Inc., 51 Franklin St, Fifth Floor, Boston, MA 02110-1301 USA.
  -->

<x:root
	xmlns:xsi="http://www.w3.org/2001/XMLSchema-instance"
	xsi:schemaLocation="http://xsdtesting Bug6963468.xsd"
	xmlns:x="http://xsdtesting">

	<x:E1>1</x:E1>
	<x:E1>true</x:E1>
	<x:E1>false</x:E1>
	<x:E1>x</x:E1>
	<x:E1>y</x:E1>
	<x:E2>1</x:E2>
	<x:E3 x:att1="123"/>
</x:root>

